{
  "$schema": "https://json-schema.org/draft/2020-12/schema",
  "$id": "urn:global-geochemical-atlas:request:v4",
  "title": "Global geochemical atlas evidence-aware request",
  "type": "object",
  "additionalProperties": false,
  "required": ["elements", "region", "media"],
  "properties": {
    "elements": {
      "type": "array",
      "minItems": 1,
      "uniqueItems": true,
      "items": {"type": "string", "minLength": 1}
    },
    "region": {
      "oneOf": [
        {"type": "string", "minLength": 1},
        {
          "type": "object",
          "additionalProperties": false,
          "required": ["bbox"],
          "properties": {
            "bbox": {
              "type": "array",
              "prefixItems": [
                {"type": "number", "minimum": -180, "maximum": 180},
                {"type": "number", "minimum": -90, "maximum": 90},
                {"type": "number", "minimum": -180, "maximum": 180},
                {"type": "number", "minimum": -90, "maximum": 90}
              ],
              "minItems": 4,
              "maxItems": 4
            }
          }
        }
      ]
    },
    "media": {
      "type": "array",
      "minItems": 1,
      "uniqueItems": true,
      "items": {
        "type": "string",
        "enum": ["rock", "soil", "sediment", "water", "mineral", "concentrate"]
      }
    },
    "measurement_basis": {
      "type": ["array", "null"],
      "minItems": 1,
      "items": {"type": "string", "minLength": 1},
      "uniqueItems": true
    },
    "geology_units": {
      "type": ["array", "null"],
      "minItems": 1,
      "maxItems": 50,
      "items": {"type": "string", "minLength": 1, "maxLength": 160},
      "uniqueItems": true,
      "description": "Exact normalized geological-unit labels to retain after source/geology matching."
    },
    "geology_match": {
      "type": "string",
      "enum": ["reported_or_matched", "reported", "matched"],
      "default": "reported_or_matched"
    },
    "time_range": {
      "type": ["array", "null"],
      "prefixItems": [
        {"type": "string", "pattern": "^[0-9]{4}(?:-|$)"},
        {"type": "string", "pattern": "^[0-9]{4}(?:-|$)"}
      ],
      "minItems": 2,
      "maxItems": 2
    },
    "sources": {
      "oneOf": [
        {"const": "auto"},
        {"type": "array", "minItems": 1, "uniqueItems": true, "items": {"type": "string"}}
      ],
      "default": "auto"
    },
    "output_formats": {
      "type": "array",
      "uniqueItems": true,
      "items": {"type": "string", "enum": ["csv", "json", "geojson", "html_map"]},
      "default": ["csv", "json", "geojson", "html_map"]
    },
    "target_crs": {"const": "EPSG:4326", "default": "EPSG:4326"},
    "license_policy": {"const": "open_only", "default": "open_only"},
    "research_use_policy": {
      "type": "string",
      "enum": ["permitted_research", "open_research_only", "include_permission_required"],
      "default": "permitted_research"
    },
    "minimum_evidence_tier": {
      "type": "string",
      "enum": ["A", "B", "C", "D", "U"],
      "default": "D"
    },
    "minimum_use_mode": {
      "type": "string",
      "enum": ["discovery", "raw_observation", "normalized_analysis", "benchmark_ready"],
      "default": "normalized_analysis"
    },
    "max_records": {"type": "integer", "minimum": 1, "maximum": 200000, "default": 50000},
    "offline": {"type": "boolean", "default": false}
  }
}
