{
  "elements": [
    "As",
    "Cr",
    "Cu",
    "Ni",
    "Pb",
    "Zn"
  ],
  "license_policy": "open_only",
  "max_records": 50000,
  "media": [
    "soil",
    "sediment"
  ],
  "minimum_evidence_tier": "D",
  "minimum_use_mode": "normalized_analysis",
  "offline": true,
  "output_formats": [
    "csv",
    "json",
    "geojson",
    "html_map"
  ],
  "region": {
    "bbox": [
      73.0,
      18.0,
      135.0,
      54.0
    ]
  },
  "research_use_policy": "permitted_research",
  "sources": "auto"
}
